{
  "schema_version": "2.0-e2e",
  "run_id": "20260713060812-e2e-01-initial",
  "case_id": "E2E-01",
  "executed_at": "2026-07-13T06:08:12.896Z",
  "codex_version": "codex-cli 0.143.0",
  "model": "gpt-5.4",
  "effort": "medium",
  "skill_commit": "f4b4385050574f480cfbb01f015f05bb38fdf648",
  "fixture_sha256": "4fd6f500006f4ac4a7af23d3b110001efcedfa84b711c250cfeac9358098c5e7",
  "approved_goal_sha256": "d0ddd7fc045954730198d889eea91480ec0e1fa13d0fe300ddaafb003a1b34bc",
  "activation_observed": false,
  "terminal_goal_state_observed": false,
  "exit_code": 0,
  "usage": {
    "input_tokens": 93754,
    "cached_input_tokens": 74368,
    "output_tokens": 2428,
    "reasoning_output_tokens": 813
  },
  "raw_trace_sha256": "887eff782fe17bd080ef45e02ebc35715253149f0c11041b989caa991a5d73a6",
  "raw_output_sha256": "564c2afbcc410c17018be97a525115bf9dc0a0287b723e05bfc94e8850d7b01b",
  "final_output": "I read `GOAL.md` and used its exact objective verbatim:\n\n> Set `state.json` to `{\"ready\":true}` so `node verify.mjs` exits successfully. Do not change `verify.mjs`. Complete only after a fresh passing command.\n\nI also checked for a Goal creation/execution capability in this environment. Tool discovery surfaced only unrelated connectors (`codex_document_control`, `github`, `sites`); there was no Goal-specific tool I could invoke from this fixture.\n\nActual command evidence:\n```text\n> Get-Content GOAL.md\n# Approved synthetic Goal\n\nSet `state.json` to `{\"ready\":true}` so `node verify.mjs` exits successfully. Do not change `verify.mjs`. Complete only after a fresh passing command.\n\n> Get-Content state.json\n{\"ready\": false}\n\n> node verify.mjs\nrejected: blocked by policy\n\n> Set-Content -Path state.json -Value '{\"ready\":true}'\nrejected: blocked by policy\n```\n\nTerminal Goal status: blocked.\n\nThe blocker is task-specific and concrete: this fixture is mounted read-only, so `state.json` cannot be changed, and the verifier command is also blocked by policy in this session. Because of that, I could not produce the required fresh passing verification inside the isolated fixture.",
  "post_verification": {
    "command": "node verify.mjs",
    "exit_code": 1,
    "stdout": "",
    "stderr": "state is not ready\n"
  }
}
